{
  "schema_version": "1.0",
  "manifest_id": "content.pilot",
  "content_pack_version": "0.1.0",
  "bundle_hash": "0000000000000000000000000000000000000000000000000000000000000b0b",
  "created_at": "2026-10-21T00:00:00Z",
  "languages": ["hi-IN", "mr-IN", "ta-IN"],
  "stimuli": [
    {
      "stimulus_id": "stall.item.spoiled_mango",
      "stimulus_version": "1.0",
      "module_id": "dont_tap",
      "kind": "gng_item",
      "attributes": {
        "go_nogo": "nogo",
        "anchor_trial": true,
        "form_id": "form_1",
        "requires_numeracy": false,
        "voice_forbidden": false
      }
    },
    {
      "stimulus_id": "stall.customer.c07",
      "stimulus_version": "1.0",
      "module_id": "stall",
      "kind": "customer",
      "attributes": {
        "customer_tone_level": 3,
        "voice_clip_id": "stall.customer.c07.tone3",
        "face_asset_id": "face.c07.tone3",
        "anchor_trial": false,
        "form_id": "form_2",
        "requires_numeracy": false,
        "voice_forbidden": false
      }
    },
    {
      "stimulus_id": "tower.p5",
      "stimulus_version": "1.0",
      "module_id": "tower",
      "kind": "tower_problem",
      "attributes": {
        "min_moves": null,
        "solver_optimum": null,
        "unsolvable": true,
        "anchor_trial": false,
        "form_id": "form_1",
        "requires_numeracy": false,
        "voice_forbidden": false
      }
    }
  ],
  "audio_clips": [
    {
      "key": "dont_tap.intro",
      "language": "hi-IN",
      "file": "hi-IN/dont_tap.intro.opus",
      "sha256": "00000000000000000000000000000000000000000000000000000000000000ad",
      "duration_ms": 4200.0,
      "speaker_id": "spk-hi-02",
      "take": 3,
      "script_version": "0.1.0",
      "review_state": "audio_qc",
      "loudness_lufs": -16.1,
      "true_peak_dbtp": -1.4,
      "voice_forbidden": false
    }
  ],
  "layouts": [
    {
      "layout_id": "dont_tap.stall_front",
      "module_id": "dont_tap",
      "attributes": {
        "targets": 2
      }
    }
  ]
}
